name,id,from,to,text
3 - 7 - 2.7 Probabilistic Topic Models- Mixture of Unigram Language Models (00-12-39).srt,159,622.81,628.5,representing a background topic that we can set to attract the common 
3 - 7 - 2.7 Probabilistic Topic Models- Mixture of Unigram Language Models (00-12-39).srt,160,628.5,632.84,words because common words would be assigned a high probability in this model. 
3 - 7 - 2.7 Probabilistic Topic Models- Mixture of Unigram Language Models (00-12-39).srt,161,633.95,636.87,So the parameters can be collectively called 
3 - 7 - 2.7 Probabilistic Topic Models- Mixture of Unigram Language Models (00-12-39).srt,162,636.87,640.38,Lambda which I show here you can again 
3 - 7 - 2.7 Probabilistic Topic Models- Mixture of Unigram Language Models (00-12-39).srt,163,641.56,645.52,think about the question about how many parameters are we talking about exactly. 
3 - 7 - 2.7 Probabilistic Topic Models- Mixture of Unigram Language Models (00-12-39).srt,164,645.52,650.92,This is usually a good exercise to do because it allows you to see the model in 
3 - 7 - 2.7 Probabilistic Topic Models- Mixture of Unigram Language Models (00-12-39).srt,165,650.92,656.47,depth and to have a complete understanding of what's going on this model. 
3 - 7 - 2.7 Probabilistic Topic Models- Mixture of Unigram Language Models (00-12-39).srt,166,656.47,658.7,_And we have mixing weights, of course, also. _
3 - 7 - 2.7 Probabilistic Topic Models- Mixture of Unigram Language Models (00-12-39).srt,167,659.79,662.34,So what does a likelihood function look like? 
3 - 7 - 2.7 Probabilistic Topic Models- Mixture of Unigram Language Models (00-12-39).srt,168,662.34,666.62,_Well, it looks very similar to what we had before. _
3 - 7 - 2.7 Probabilistic Topic Models- Mixture of Unigram Language Models (00-12-39).srt,169,666.62,669.1,_So for the document, _
3 - 7 - 2.7 Probabilistic Topic Models- Mixture of Unigram Language Models (00-12-39).srt,170,669.1,674.26,first it's a product over all the words in the document exactly the same as before. 
3 - 7 - 2.7 Probabilistic Topic Models- Mixture of Unigram Language Models (00-12-39).srt,171,674.26,680.2,The only difference is that inside here now it's a sum instead of just one. 
3 - 7 - 2.7 Probabilistic Topic Models- Mixture of Unigram Language Models (00-12-39).srt,172,680.2,684.42,So you might have recalled before we just had this one there. 
3 - 7 - 2.7 Probabilistic Topic Models- Mixture of Unigram Language Models (00-12-39).srt,173,685.42,690.61,But now we have this sum because of the mixture model. 
3 - 7 - 2.7 Probabilistic Topic Models- Mixture of Unigram Language Models (00-12-39).srt,174,690.61,694.8,And because of the mixture model we also have to introduce a probability of 
3 - 7 - 2.7 Probabilistic Topic Models- Mixture of Unigram Language Models (00-12-39).srt,175,694.8,697.64,choosing that particular component of distribution. 
3 - 7 - 2.7 Probabilistic Topic Models- Mixture of Unigram Language Models (00-12-39).srt,176,699.53,704.47,_And so this is just another way of writing, and _
3 - 7 - 2.7 Probabilistic Topic Models- Mixture of Unigram Language Models (00-12-39).srt,177,704.47,709.8,by using a product over all the unique words in our vocabulary instead of 
3 - 7 - 2.7 Probabilistic Topic Models- Mixture of Unigram Language Models (00-12-39).srt,178,709.8,712.878,having that product over all the positions in the document. 
3 - 7 - 2.7 Probabilistic Topic Models- Mixture of Unigram Language Models (00-12-39).srt,179,712.878,717.582,And this form where we look at the different and unique words is 
3 - 7 - 2.7 Probabilistic Topic Models- Mixture of Unigram Language Models (00-12-39).srt,180,717.582,724.72,a commutative that formed for computing the maximum likelihood estimate later. 
3 - 7 - 2.7 Probabilistic Topic Models- Mixture of Unigram Language Models (00-12-39).srt,181,724.72,729.965,_And the maximum likelihood estimator is, as usual, _
3 - 7 - 2.7 Probabilistic Topic Models- Mixture of Unigram Language Models (00-12-39).srt,182,729.965,735.29,just to find the parameters that would maximize the likelihood function. 
3 - 7 - 2.7 Probabilistic Topic Models- Mixture of Unigram Language Models (00-12-39).srt,183,735.29,738.94,And the constraints here are of course two kinds. 
3 - 7 - 2.7 Probabilistic Topic Models- Mixture of Unigram Language Models (00-12-39).srt,184,738.94,744.125,One is what are probabilities in each 
3 - 7 - 2.7 Probabilistic Topic Models- Mixture of Unigram Language Models (00-12-39).srt,185,744.125,749.142,[INAUDIBLE] must sum to 1 the other is 
3 - 7 - 2.7 Probabilistic Topic Models- Mixture of Unigram Language Models (00-12-39).srt,186,749.142,755.343,the choice of each [INAUDIBLE] must sum to 1. 
3 - 7 - 2.7 Probabilistic Topic Models- Mixture of Unigram Language Models (00-12-39).srt,187,755.343,759.799,[MUSIC] 
