name,id,from,to,text
4 - 11 - 3.11 Text Categorization- Discriminative Classifier Part 2 (00-31-46).srt,162,733.714,738.622,Now this is where it's convenient when we have chosen y i as -1 for 
4 - 11 - 3.11 Text Categorization- Discriminative Classifier Part 2 (00-31-46).srt,163,738.622,740.2,_the other category, _
4 - 11 - 3.11 Text Categorization- Discriminative Classifier Part 2 (00-31-46).srt,164,740.2,745.83,because it turns out that we can either combine the two into one constraint. 
4 - 11 - 3.11 Text Categorization- Discriminative Classifier Part 2 (00-31-46).srt,165,746.832,752.085,y i multiplied by the classifier value must be larger than or equal to 1. 
4 - 11 - 3.11 Text Categorization- Discriminative Classifier Part 2 (00-31-46).srt,166,753.21,755.484,_And obviously when y i is just 1, _
4 - 11 - 3.11 Text Categorization- Discriminative Classifier Part 2 (00-31-46).srt,167,755.484,759.968,you see this is the same as the constraint on the left-hand side. 
4 - 11 - 3.11 Text Categorization- Discriminative Classifier Part 2 (00-31-46).srt,168,759.968,768.02,_But when y i is -1, you also see that this is equivalent to the other inequality. _
4 - 11 - 3.11 Text Categorization- Discriminative Classifier Part 2 (00-31-46).srt,169,768.02,773.06,_So this one actually captures both constraints in a unified way, _
4 - 11 - 3.11 Text Categorization- Discriminative Classifier Part 2 (00-31-46).srt,170,773.06,776.96,and that's a convenient way of capturing these constraints. 
4 - 11 - 3.11 Text Categorization- Discriminative Classifier Part 2 (00-31-46).srt,171,776.96,778.137,What's our second goal? 
4 - 11 - 3.11 Text Categorization- Discriminative Classifier Part 2 (00-31-46).srt,172,778.137,780.414,_Well, that's to maximize margin, so _
4 - 11 - 3.11 Text Categorization- Discriminative Classifier Part 2 (00-31-46).srt,173,780.414,784.6,we want to ensure that separator can do well on the training data. 
4 - 11 - 3.11 Text Categorization- Discriminative Classifier Part 2 (00-31-46).srt,174,784.6,788.109,_But then, among all the cases where we can separate the data, _
4 - 11 - 3.11 Text Categorization- Discriminative Classifier Part 2 (00-31-46).srt,175,788.109,792.172,we also would like to choose the separator that has the largest margin. 
4 - 11 - 3.11 Text Categorization- Discriminative Classifier Part 2 (00-31-46).srt,176,792.172,798.758,Now the margin can be assumed to be related to the magnitude of the weight. 
4 - 11 - 3.11 Text Categorization- Discriminative Classifier Part 2 (00-31-46).srt,177,798.758,803.777,And so w transform multiplied by w would give 
4 - 11 - 3.11 Text Categorization- Discriminative Classifier Part 2 (00-31-46).srt,178,803.777,809.893,us basically the sum of squares of all those weights. 
4 - 11 - 3.11 Text Categorization- Discriminative Classifier Part 2 (00-31-46).srt,179,809.893,815.691,_So to have a small value for this expression, _
4 - 11 - 3.11 Text Categorization- Discriminative Classifier Part 2 (00-31-46).srt,180,815.691,820.43,it means all the w i's must be small. 
4 - 11 - 3.11 Text Categorization- Discriminative Classifier Part 2 (00-31-46).srt,181,822.44,825.71,So we've just assumed that we have a constraint for 
4 - 11 - 3.11 Text Categorization- Discriminative Classifier Part 2 (00-31-46).srt,182,826.93,830.89,getting the data on the training set to be classified correctly. 
4 - 11 - 3.11 Text Categorization- Discriminative Classifier Part 2 (00-31-46).srt,183,830.89,837.649,_Now we also have the objective that's tied into a maximization of margin, _
4 - 11 - 3.11 Text Categorization- Discriminative Classifier Part 2 (00-31-46).srt,184,837.649,843.013,_and this is simply to minimize w transpose multiplied by w, _
4 - 11 - 3.11 Text Categorization- Discriminative Classifier Part 2 (00-31-46).srt,185,843.013,846.251,and we often denote this by phi of w. 
4 - 11 - 3.11 Text Categorization- Discriminative Classifier Part 2 (00-31-46).srt,186,846.251,850.616,So now you can see this is basically a optimization problem. 
4 - 11 - 3.11 Text Categorization- Discriminative Classifier Part 2 (00-31-46).srt,187,850.616,855.044,_We have some variables to optimize, and these are the weights and _
4 - 11 - 3.11 Text Categorization- Discriminative Classifier Part 2 (00-31-46).srt,188,855.044,857.54,b and we have some constraints. 
4 - 11 - 3.11 Text Categorization- Discriminative Classifier Part 2 (00-31-46).srt,189,857.54,858.949,These are linear constraints and 
4 - 11 - 3.11 Text Categorization- Discriminative Classifier Part 2 (00-31-46).srt,190,858.949,862.38,the objective function is a quadratic function of the weights. 
4 - 11 - 3.11 Text Categorization- Discriminative Classifier Part 2 (00-31-46).srt,191,862.38,865.37,_So this a quadratic program with linear constraints, _
4 - 11 - 3.11 Text Categorization- Discriminative Classifier Part 2 (00-31-46).srt,192,865.37,870.05,and there are standard algorithm that are variable for solving this problem. 
4 - 11 - 3.11 Text Categorization- Discriminative Classifier Part 2 (00-31-46).srt,193,870.05,874.19,And once we solve the problem we obtain the weights w and b. 
4 - 11 - 3.11 Text Categorization- Discriminative Classifier Part 2 (00-31-46).srt,194,874.19,877.08,And then this would give us a well-defined classifier. 
4 - 11 - 3.11 Text Categorization- Discriminative Classifier Part 2 (00-31-46).srt,195,877.08,882.16,So we can then use this classifier to classify any new text objects. 
4 - 11 - 3.11 Text Categorization- Discriminative Classifier Part 2 (00-31-46).srt,196,882.16,887.19,_Now the previous formulation did not allow any error in the classification, _
4 - 11 - 3.11 Text Categorization- Discriminative Classifier Part 2 (00-31-46).srt,197,887.19,890.448,but sometimes the data may not be linear to the separator. 
4 - 11 - 3.11 Text Categorization- Discriminative Classifier Part 2 (00-31-46).srt,198,890.448,894.69,That means that they may not look as nice as you have seen on 
4 - 11 - 3.11 Text Categorization- Discriminative Classifier Part 2 (00-31-46).srt,199,894.69,899.3,the previous slide where a line can separate all of them. 
4 - 11 - 3.11 Text Categorization- Discriminative Classifier Part 2 (00-31-46).srt,200,899.3,902.85,And what would happen if we allowed some errors? 
4 - 11 - 3.11 Text Categorization- Discriminative Classifier Part 2 (00-31-46).srt,201,902.85,904.98,_Well, the principle can stay. _
4 - 11 - 3.11 Text Categorization- Discriminative Classifier Part 2 (00-31-46).srt,202,904.98,909.305,We want to minimize the training error but try to also maximize the margin. 
4 - 11 - 3.11 Text Categorization- Discriminative Classifier Part 2 (00-31-46).srt,203,909.305,912.27,_But in this case we have a soft margin, _
4 - 11 - 3.11 Text Categorization- Discriminative Classifier Part 2 (00-31-46).srt,204,912.27,916.0,because the data points may not be completely separable. 
4 - 11 - 3.11 Text Categorization- Discriminative Classifier Part 2 (00-31-46).srt,205,917.03,924.65,So it turns out that we can easily modify SVM to accommodate this. 
4 - 11 - 3.11 Text Categorization- Discriminative Classifier Part 2 (00-31-46).srt,206,924.65,928.09,_So what you see here is very similar to what you have seen before, _
4 - 11 - 3.11 Text Categorization- Discriminative Classifier Part 2 (00-31-46).srt,207,928.09,931.76,but we have introduced the extra variable xi i. 
4 - 11 - 3.11 Text Categorization- Discriminative Classifier Part 2 (00-31-46).srt,208,931.76,935.61,_And we in fact will have one for each data instance, and _
4 - 11 - 3.11 Text Categorization- Discriminative Classifier Part 2 (00-31-46).srt,209,935.61,940.78,this is going to model the error that we allow for each instance. 
4 - 11 - 3.11 Text Categorization- Discriminative Classifier Part 2 (00-31-46).srt,210,940.78,943.245,But the optimization problem would be very similar. 
4 - 11 - 3.11 Text Categorization- Discriminative Classifier Part 2 (00-31-46).srt,211,943.245,944.783,_So specifically, _
4 - 11 - 3.11 Text Categorization- Discriminative Classifier Part 2 (00-31-46).srt,212,944.783,950.17,you will see we have added something to the optimization problem. 
4 - 11 - 3.11 Text Categorization- Discriminative Classifier Part 2 (00-31-46).srt,213,950.17,956.861,First we have added some error to the constraint so 
4 - 11 - 3.11 Text Categorization- Discriminative Classifier Part 2 (00-31-46).srt,214,956.861,962.119,that now we allow a Allow the classifier 
4 - 11 - 3.11 Text Categorization- Discriminative Classifier Part 2 (00-31-46).srt,215,962.119,966.76,to make some mistakes here. 
4 - 11 - 3.11 Text Categorization- Discriminative Classifier Part 2 (00-31-46).srt,216,966.76,972.86,_So, this Xi i is allowed an error. _
4 - 11 - 3.11 Text Categorization- Discriminative Classifier Part 2 (00-31-46).srt,217,972.86,976.56,_If we set Xi i to 0, then we go back to the original constraint. _
4 - 11 - 3.11 Text Categorization- Discriminative Classifier Part 2 (00-31-46).srt,218,976.56,980.26,We want every instance to be classified accurately. 
4 - 11 - 3.11 Text Categorization- Discriminative Classifier Part 2 (00-31-46).srt,219,980.26,986.42,_But, if we allow this to be non-zero, then we allow some errors here. _
4 - 11 - 3.11 Text Categorization- Discriminative Classifier Part 2 (00-31-46).srt,220,986.42,990.73,_In fact, if the length of the Xi i is very large, the error can be very, very large. _
4 - 11 - 3.11 Text Categorization- Discriminative Classifier Part 2 (00-31-46).srt,221,990.73,993.27,_So naturally, we don't want this to happen. _
4 - 11 - 3.11 Text Categorization- Discriminative Classifier Part 2 (00-31-46).srt,222,993.27,997.57,So we want to then also minimize this Xi i. 
4 - 11 - 3.11 Text Categorization- Discriminative Classifier Part 2 (00-31-46).srt,223,997.57,1001.94,_So, because Xi i needs to be minimized in order to control the error. _
4 - 11 - 3.11 Text Categorization- Discriminative Classifier Part 2 (00-31-46).srt,224,1002.94,1006.02,_And so, as a result, in the objective function, _
4 - 11 - 3.11 Text Categorization- Discriminative Classifier Part 2 (00-31-46).srt,225,1006.02,1010.91,_we also add more to the original one, which is only W, _
4 - 11 - 3.11 Text Categorization- Discriminative Classifier Part 2 (00-31-46).srt,226,1010.91,1015.19,_by basically ensuring that we not only minimize the weights, but _
4 - 11 - 3.11 Text Categorization- Discriminative Classifier Part 2 (00-31-46).srt,227,1015.19,1019.13,_also minimize the errors, as you see here. _
4 - 11 - 3.11 Text Categorization- Discriminative Classifier Part 2 (00-31-46).srt,228,1019.13,1022.705,Here we simply take a sum over all the instances. 
4 - 11 - 3.11 Text Categorization- Discriminative Classifier Part 2 (00-31-46).srt,229,1022.705,1027.695,Each one has a Xi i to model the error allowed for that instance. 
4 - 11 - 3.11 Text Categorization- Discriminative Classifier Part 2 (00-31-46).srt,230,1027.695,1030.413,_And when we combine them together, _
4 - 11 - 3.11 Text Categorization- Discriminative Classifier Part 2 (00-31-46).srt,231,1030.413,1034.68,we basically want to minimize the errors on all of them. 
4 - 11 - 3.11 Text Categorization- Discriminative Classifier Part 2 (00-31-46).srt,232,1036.35,1041.001,_Now you see there's a parameter C here, and that's a constant to control _
4 - 11 - 3.11 Text Categorization- Discriminative Classifier Part 2 (00-31-46).srt,233,1041.001,1045.74,the trade-off between minimizing the errors and maximizing the margin. 
4 - 11 - 3.11 Text Categorization- Discriminative Classifier Part 2 (00-31-46).srt,234,1045.74,1047.888,_If C is set to zero, you can see, _
4 - 11 - 3.11 Text Categorization- Discriminative Classifier Part 2 (00-31-46).srt,235,1047.888,1053.07,we go back to the original object function where we only maximize the margin. 
4 - 11 - 3.11 Text Categorization- Discriminative Classifier Part 2 (00-31-46).srt,236,1054.34,1058.368,We don't really optimize the training errors and 
4 - 11 - 3.11 Text Categorization- Discriminative Classifier Part 2 (00-31-46).srt,237,1058.368,1063.73,then Xi i can be set to a very large value to make the constraints easy to satisfy. 
4 - 11 - 3.11 Text Categorization- Discriminative Classifier Part 2 (00-31-46).srt,238,1063.73,1066.512,_That's not very good of course, so _
4 - 11 - 3.11 Text Categorization- Discriminative Classifier Part 2 (00-31-46).srt,239,1066.512,1070.884,_C should be set to a non-zero value, a positive value. _
4 - 11 - 3.11 Text Categorization- Discriminative Classifier Part 2 (00-31-46).srt,240,1070.884,1073.412,_But when C is set to a very, very large value, _
4 - 11 - 3.11 Text Categorization- Discriminative Classifier Part 2 (00-31-46).srt,241,1073.412,1078.143,we'll see the object of the function will be dominated mostly by the training errors 
4 - 11 - 3.11 Text Categorization- Discriminative Classifier Part 2 (00-31-46).srt,242,1078.143,1082.42,and so the optimization of margin will then play a secondary role. 
4 - 11 - 3.11 Text Categorization- Discriminative Classifier Part 2 (00-31-46).srt,243,1082.42,1086.35,_So if that happens, what would happen is _
4 - 11 - 3.11 Text Categorization- Discriminative Classifier Part 2 (00-31-46).srt,244,1087.42,1091.42,_then we will try to do our best to minimize the training errors, but _
4 - 11 - 3.11 Text Categorization- Discriminative Classifier Part 2 (00-31-46).srt,245,1091.42,1094.73,then we're not going to take care of the margin and 
4 - 11 - 3.11 Text Categorization- Discriminative Classifier Part 2 (00-31-46).srt,246,1094.73,1099.27,that affects the generalization factors of the classify for future data. 
4 - 11 - 3.11 Text Categorization- Discriminative Classifier Part 2 (00-31-46).srt,247,1099.27,1100.548,So it's also not good. 
4 - 11 - 3.11 Text Categorization- Discriminative Classifier Part 2 (00-31-46).srt,248,1100.548,1108.175,_So in particular, this parameter C has to be actually set carefully. _
4 - 11 - 3.11 Text Categorization- Discriminative Classifier Part 2 (00-31-46).srt,249,1108.175,1112.045,And this is just like in the case of k-nearest neighbor where you need 
4 - 11 - 3.11 Text Categorization- Discriminative Classifier Part 2 (00-31-46).srt,250,1112.045,1114.08,to optimize a number of neighbors. 
4 - 11 - 3.11 Text Categorization- Discriminative Classifier Part 2 (00-31-46).srt,251,1114.08,1115.51,Here you need to optimize the C. 
4 - 11 - 3.11 Text Categorization- Discriminative Classifier Part 2 (00-31-46).srt,252,1115.51,1120.51,_And this is, in general, also achievable by doing cross-validation. _
4 - 11 - 3.11 Text Categorization- Discriminative Classifier Part 2 (00-31-46).srt,253,1120.51,1123.331,_Basically, you look at the empirical data and _
4 - 11 - 3.11 Text Categorization- Discriminative Classifier Part 2 (00-31-46).srt,254,1123.331,1127.61,see what value C should be set to in order to optimize the performance. 
4 - 11 - 3.11 Text Categorization- Discriminative Classifier Part 2 (00-31-46).srt,255,1129.05,1130.39,_Now with this modification, _
4 - 11 - 3.11 Text Categorization- Discriminative Classifier Part 2 (00-31-46).srt,256,1130.39,1134.25,the problem is still quadratic programming with linear constraints so the optimizing 
4 - 11 - 3.11 Text Categorization- Discriminative Classifier Part 2 (00-31-46).srt,257,1134.25,1140.003,algorithm can be actually applied to solve this different version of the program. 
4 - 11 - 3.11 Text Categorization- Discriminative Classifier Part 2 (00-31-46).srt,258,1142.08,1145.78,_Again, once we have obtained the weights and the bias, _
4 - 11 - 3.11 Text Categorization- Discriminative Classifier Part 2 (00-31-46).srt,259,1145.78,1151.36,then we can have classifier that's ready for classifying new objects. 
4 - 11 - 3.11 Text Categorization- Discriminative Classifier Part 2 (00-31-46).srt,260,1151.36,1153.566,So that's the basic idea of SVM. 
4 - 11 - 3.11 Text Categorization- Discriminative Classifier Part 2 (00-31-46).srt,261,1156.993,1160.402,_So to summarize the text categorization methods, _
4 - 11 - 3.11 Text Categorization- Discriminative Classifier Part 2 (00-31-46).srt,262,1160.402,1165.17,_where we introduce the many methods, and some are generative models. _
4 - 11 - 3.11 Text Categorization- Discriminative Classifier Part 2 (00-31-46).srt,263,1165.17,1167.14,Some are discriminative methods. 
4 - 11 - 3.11 Text Categorization- Discriminative Classifier Part 2 (00-31-46).srt,264,1167.14,1172.23,And these tend to perform similarly when optimized. 
4 - 11 - 3.11 Text Categorization- Discriminative Classifier Part 2 (00-31-46).srt,265,1172.23,1177.92,_So there's still no clear winner, although each one has its pros and cons. _
4 - 11 - 3.11 Text Categorization- Discriminative Classifier Part 2 (00-31-46).srt,266,1177.92,1182.46,And the performance might also vary on different data sets for 
4 - 11 - 3.11 Text Categorization- Discriminative Classifier Part 2 (00-31-46).srt,267,1182.46,1184.32,different problems. 
4 - 11 - 3.11 Text Categorization- Discriminative Classifier Part 2 (00-31-46).srt,268,1184.32,1190.61,And one reason is also because the feature representation is very critical 
4 - 11 - 3.11 Text Categorization- Discriminative Classifier Part 2 (00-31-46).srt,269,1192.28,1196.47,and these methods all require effective feature representation. 
4 - 11 - 3.11 Text Categorization- Discriminative Classifier Part 2 (00-31-46).srt,270,1196.47,1199.4,_And to design an effective feature set, _
4 - 11 - 3.11 Text Categorization- Discriminative Classifier Part 2 (00-31-46).srt,271,1199.4,1203.53,_we need domain knowledge and humans definitely play an important role here, _
4 - 11 - 3.11 Text Categorization- Discriminative Classifier Part 2 (00-31-46).srt,272,1203.53,1205.608,although there are new machine learning methods and 
4 - 11 - 3.11 Text Categorization- Discriminative Classifier Part 2 (00-31-46).srt,273,1205.608,1210.02,algorithm representation learning that can help with learning features. 
4 - 11 - 3.11 Text Categorization- Discriminative Classifier Part 2 (00-31-46).srt,274,1212.64,1218.169,And another common thing is that they might 
4 - 11 - 3.11 Text Categorization- Discriminative Classifier Part 2 (00-31-46).srt,275,1218.169,1223.546,_be performing similarly on the data set, _
4 - 11 - 3.11 Text Categorization- Discriminative Classifier Part 2 (00-31-46).srt,276,1223.546,1228.22,but with different mistakes. 
4 - 11 - 3.11 Text Categorization- Discriminative Classifier Part 2 (00-31-46).srt,277,1228.22,1230.913,_And so, their performance might be similar, but _
4 - 11 - 3.11 Text Categorization- Discriminative Classifier Part 2 (00-31-46).srt,278,1230.913,1234.07,then the mistakes they make might be different. 
4 - 11 - 3.11 Text Categorization- Discriminative Classifier Part 2 (00-31-46).srt,279,1234.07,1237.63,So that means it's useful to compare different methods for 
4 - 11 - 3.11 Text Categorization- Discriminative Classifier Part 2 (00-31-46).srt,280,1237.63,1242.69,a particular problem and then maybe combine multiple methods 
4 - 11 - 3.11 Text Categorization- Discriminative Classifier Part 2 (00-31-46).srt,281,1242.69,1249.092,because this can improve the robustness and they won't make the same mistakes. 
4 - 11 - 3.11 Text Categorization- Discriminative Classifier Part 2 (00-31-46).srt,282,1249.092,1254.192,So assemble approaches that would combine different 
4 - 11 - 3.11 Text Categorization- Discriminative Classifier Part 2 (00-31-46).srt,283,1254.192,1259.99,methods tend to be more robust and can be useful in practice. 
4 - 11 - 3.11 Text Categorization- Discriminative Classifier Part 2 (00-31-46).srt,284,1259.99,1264.53,_Most techniques that we introduce use the supervised machine learning, _
4 - 11 - 3.11 Text Categorization- Discriminative Classifier Part 2 (00-31-46).srt,285,1264.53,1266.99,which is a very general method. 
4 - 11 - 3.11 Text Categorization- Discriminative Classifier Part 2 (00-31-46).srt,286,1266.99,1270.975,So that means that these methods can be actually applied to any text or 
4 - 11 - 3.11 Text Categorization- Discriminative Classifier Part 2 (00-31-46).srt,287,1270.975,1272.58,categorization problem. 
4 - 11 - 3.11 Text Categorization- Discriminative Classifier Part 2 (00-31-46).srt,288,1272.58,1277.554,As long as we have humans to help annotate some training data sets and 
4 - 11 - 3.11 Text Categorization- Discriminative Classifier Part 2 (00-31-46).srt,289,1277.554,1283.493,_design features, then supervising machine learning and all these classifiers _
4 - 11 - 3.11 Text Categorization- Discriminative Classifier Part 2 (00-31-46).srt,290,1283.493,1289.255,can be easily applied to those problems to solve the categorization problem to 
4 - 11 - 3.11 Text Categorization- Discriminative Classifier Part 2 (00-31-46).srt,291,1289.255,1294.431,allow us to characterize content of text concisely with categories. 
4 - 11 - 3.11 Text Categorization- Discriminative Classifier Part 2 (00-31-46).srt,292,1294.431,1298.716,Or to predict the sum properties of real world 
4 - 11 - 3.11 Text Categorization- Discriminative Classifier Part 2 (00-31-46).srt,293,1298.716,1303.25,variables that are associated with text data. 
4 - 11 - 3.11 Text Categorization- Discriminative Classifier Part 2 (00-31-46).srt,294,1303.25,1307.875,_The computers, of course, here are trying to optimize the combinations of _
4 - 11 - 3.11 Text Categorization- Discriminative Classifier Part 2 (00-31-46).srt,295,1307.875,1309.908,the features provided by human. 
4 - 11 - 3.11 Text Categorization- Discriminative Classifier Part 2 (00-31-46).srt,296,1309.908,1313.357,_And as I said, there are many different ways of combining them and _
4 - 11 - 3.11 Text Categorization- Discriminative Classifier Part 2 (00-31-46).srt,297,1313.357,1316.13,they also optimize different object or functions. 
4 - 11 - 3.11 Text Categorization- Discriminative Classifier Part 2 (00-31-46).srt,298,1318.18,1322.24,_But in order to achieve good performance, they all require effective features and _
4 - 11 - 3.11 Text Categorization- Discriminative Classifier Part 2 (00-31-46).srt,299,1322.24,1323.75,also plenty of training data. 
4 - 11 - 3.11 Text Categorization- Discriminative Classifier Part 2 (00-31-46).srt,300,1324.77,1328.87,_So as a general rule, and if you can improve the feature representation, _
4 - 11 - 3.11 Text Categorization- Discriminative Classifier Part 2 (00-31-46).srt,301,1328.87,1333.86,_and then provide more training data, then you can generally do better. _
4 - 11 - 3.11 Text Categorization- Discriminative Classifier Part 2 (00-31-46).srt,302,1333.86,1338.39,Performance is often much more affected by the effectiveness of 
4 - 11 - 3.11 Text Categorization- Discriminative Classifier Part 2 (00-31-46).srt,303,1338.39,1343.03,features than by the choice of specific classifiers. 
4 - 11 - 3.11 Text Categorization- Discriminative Classifier Part 2 (00-31-46).srt,304,1343.03,1346.972,So feature design tends to be more important than the choice of specific 
4 - 11 - 3.11 Text Categorization- Discriminative Classifier Part 2 (00-31-46).srt,305,1346.972,1347.768,classifier. 
4 - 11 - 3.11 Text Categorization- Discriminative Classifier Part 2 (00-31-46).srt,306,1350.844,1354.17,_So, how do we design effective features? _
4 - 11 - 3.11 Text Categorization- Discriminative Classifier Part 2 (00-31-46).srt,307,1354.17,1357.36,_Well, unfortunately, this is very application-specific. _
4 - 11 - 3.11 Text Categorization- Discriminative Classifier Part 2 (00-31-46).srt,308,1357.36,1363.108,So there's no really much general thing to say here. 
4 - 11 - 3.11 Text Categorization- Discriminative Classifier Part 2 (00-31-46).srt,309,1363.108,1367.672,But we can do some analysis of the categorization problem and 
4 - 11 - 3.11 Text Categorization- Discriminative Classifier Part 2 (00-31-46).srt,310,1367.672,1374.4,try to understand what kind of features might help us distinguish categories. 
4 - 11 - 3.11 Text Categorization- Discriminative Classifier Part 2 (00-31-46).srt,311,1374.4,1379.72,_And in general, we can use a lot of domain knowledge to help us design features. _
4 - 11 - 3.11 Text Categorization- Discriminative Classifier Part 2 (00-31-46).srt,312,1381.64,1386.18,And another way to figure out the effective features is 
4 - 11 - 3.11 Text Categorization- Discriminative Classifier Part 2 (00-31-46).srt,313,1386.18,1390.23,to do error analysis on the categorization results. 
4 - 11 - 3.11 Text Categorization- Discriminative Classifier Part 2 (00-31-46).srt,314,1390.23,1391.08,_You could, for example, _
4 - 11 - 3.11 Text Categorization- Discriminative Classifier Part 2 (00-31-46).srt,315,1391.08,1396.11,look at which category tends to be confused with which other categories. 
4 - 11 - 3.11 Text Categorization- Discriminative Classifier Part 2 (00-31-46).srt,316,1396.11,1400.89,And you can use a confusion matrix to examine the errors systematically 
4 - 11 - 3.11 Text Categorization- Discriminative Classifier Part 2 (00-31-46).srt,317,1400.89,1402.34,across categories. 
4 - 11 - 3.11 Text Categorization- Discriminative Classifier Part 2 (00-31-46).srt,318,1402.34,1405.32,_And then, you can look into specific instances to _
4 - 11 - 3.11 Text Categorization- Discriminative Classifier Part 2 (00-31-46).srt,319,1405.32,1409.78,see why the mistake has been made and what features can prevent the mistake. 
4 - 11 - 3.11 Text Categorization- Discriminative Classifier Part 2 (00-31-46).srt,320,1409.78,1415.26,And this can allow you to obtain insights for design new features. 
4 - 11 - 3.11 Text Categorization- Discriminative Classifier Part 2 (00-31-46).srt,321,1415.26,1417.84,_So error analysis is very important in general, and _
