name,id,from,to,text
4 - 11 - 3.11 Text Categorization- Discriminative Classifier Part 2 (00-31-46).srt,322,1417.84,1420.86,that's where you can get the insights about your specific problem. 
4 - 11 - 3.11 Text Categorization- Discriminative Classifier Part 2 (00-31-46).srt,323,1422.15,1425.22,_And finally, we can leverage this on machine learning techniques. _
4 - 11 - 3.11 Text Categorization- Discriminative Classifier Part 2 (00-31-46).srt,324,1425.22,1428.71,_So, for example, feature selection is a technique that we haven't really talked _
4 - 11 - 3.11 Text Categorization- Discriminative Classifier Part 2 (00-31-46).srt,325,1428.71,1430.39,_about, but is very important. _
4 - 11 - 3.11 Text Categorization- Discriminative Classifier Part 2 (00-31-46).srt,326,1430.39,1434.83,And it has to do with trying to select the most useful features before you actually 
4 - 11 - 3.11 Text Categorization- Discriminative Classifier Part 2 (00-31-46).srt,327,1434.83,1436.276,train a full classifier. 
4 - 11 - 3.11 Text Categorization- Discriminative Classifier Part 2 (00-31-46).srt,328,1436.276,1440.9,Sometimes training a classifier will also help you identify which features have high 
4 - 11 - 3.11 Text Categorization- Discriminative Classifier Part 2 (00-31-46).srt,329,1440.9,1441.419,values. 
4 - 11 - 3.11 Text Categorization- Discriminative Classifier Part 2 (00-31-46).srt,330,1441.419,1444.658,There are also other ways to ensure this sparsity. 
4 - 11 - 3.11 Text Categorization- Discriminative Classifier Part 2 (00-31-46).srt,331,1444.658,1447.538,_Of the model, meaning to recognize the widths. _
4 - 11 - 3.11 Text Categorization- Discriminative Classifier Part 2 (00-31-46).srt,332,1447.538,1452.87,_For example, the SVM actually tries to minimize the weights on features. _
4 - 11 - 3.11 Text Categorization- Discriminative Classifier Part 2 (00-31-46).srt,333,1452.87,1456.63,_But you can further force some features, _
4 - 11 - 3.11 Text Categorization- Discriminative Classifier Part 2 (00-31-46).srt,334,1456.63,1459.019,force to use only a small number of features. 
4 - 11 - 3.11 Text Categorization- Discriminative Classifier Part 2 (00-31-46).srt,335,1461.08,1465.03,There are also techniques for dimension reduction. 
4 - 11 - 3.11 Text Categorization- Discriminative Classifier Part 2 (00-31-46).srt,336,1465.03,1469.45,And that's to reduce a high dimensional feature space into a low dimensional 
4 - 11 - 3.11 Text Categorization- Discriminative Classifier Part 2 (00-31-46).srt,337,1469.45,1473.15,space typically by clustering of features in various ways. 
4 - 11 - 3.11 Text Categorization- Discriminative Classifier Part 2 (00-31-46).srt,338,1473.15,1478.15,So metrics factorization has been used to do 
4 - 11 - 3.11 Text Categorization- Discriminative Classifier Part 2 (00-31-46).srt,339,1478.15,1482.86,_such a job, and this is some of the techniques are actually very similar to _
4 - 11 - 3.11 Text Categorization- Discriminative Classifier Part 2 (00-31-46).srt,340,1482.86,1484.82,the talking models that we'll discuss. 
4 - 11 - 3.11 Text Categorization- Discriminative Classifier Part 2 (00-31-46).srt,341,1484.82,1488.22,So talking morals like psa or 
4 - 11 - 3.11 Text Categorization- Discriminative Classifier Part 2 (00-31-46).srt,342,1488.22,1492.57,lda can actually help us reduce the dimension of features. 
4 - 11 - 3.11 Text Categorization- Discriminative Classifier Part 2 (00-31-46).srt,343,1492.57,1496.331,Like imagine the words our original feature. 
4 - 11 - 3.11 Text Categorization- Discriminative Classifier Part 2 (00-31-46).srt,344,1496.331,1501.97,But the can be matched to the topic space .Let's say we have k topics. 
4 - 11 - 3.11 Text Categorization- Discriminative Classifier Part 2 (00-31-46).srt,345,1501.97,1504.38,So a document can now be represented 
4 - 11 - 3.11 Text Categorization- Discriminative Classifier Part 2 (00-31-46).srt,346,1504.38,1508.75,as a vector of just k values corresponding to the topics. 
4 - 11 - 3.11 Text Categorization- Discriminative Classifier Part 2 (00-31-46).srt,347,1508.75,1512.38,_So we can let each topic define one dimension, so we have a k dimensional _
4 - 11 - 3.11 Text Categorization- Discriminative Classifier Part 2 (00-31-46).srt,348,1512.38,1517.92,space instead of the original high dimensional space corresponding to words. 
4 - 11 - 3.11 Text Categorization- Discriminative Classifier Part 2 (00-31-46).srt,349,1517.92,1521.72,And this is often another way to learn effective features. 
4 - 11 - 3.11 Text Categorization- Discriminative Classifier Part 2 (00-31-46).srt,350,1521.72,1526.2,_Especially, we could also use the categories to supervise the learning of _
4 - 11 - 3.11 Text Categorization- Discriminative Classifier Part 2 (00-31-46).srt,351,1526.2,1528.37,such low dimensional structures. 
4 - 11 - 3.11 Text Categorization- Discriminative Classifier Part 2 (00-31-46).srt,352,1529.85,1536.07,_And so, the original worth features can be also combined with such _
4 - 11 - 3.11 Text Categorization- Discriminative Classifier Part 2 (00-31-46).srt,353,1536.07,1540.48,amazing dimension features or lower dimensional space features 
4 - 11 - 3.11 Text Categorization- Discriminative Classifier Part 2 (00-31-46).srt,354,1540.48,1544.81,to provide a multi resolution which is often very useful. 
4 - 11 - 3.11 Text Categorization- Discriminative Classifier Part 2 (00-31-46).srt,355,1544.81,1549.94,Deep learning is a new technique that has been developed the machine learning. 
4 - 11 - 3.11 Text Categorization- Discriminative Classifier Part 2 (00-31-46).srt,356,1551.19,1554.89,It's particularly useful for learning representations. 
4 - 11 - 3.11 Text Categorization- Discriminative Classifier Part 2 (00-31-46).srt,357,1554.89,1559.84,_So deep learning refers to deep neural network, it's another kind of classifier, _
4 - 11 - 3.11 Text Categorization- Discriminative Classifier Part 2 (00-31-46).srt,358,1559.84,1567.11,where you can have intermediate features embedded in the models. 
4 - 11 - 3.11 Text Categorization- Discriminative Classifier Part 2 (00-31-46).srt,359,1567.11,1571.57,_That it's highly non-linear transpire, and _
4 - 11 - 3.11 Text Categorization- Discriminative Classifier Part 2 (00-31-46).srt,360,1571.57,1577.22,some recent events that's allowed us to train such a complex network effectively. 
4 - 11 - 3.11 Text Categorization- Discriminative Classifier Part 2 (00-31-46).srt,361,1577.22,1583.3,_And the technique has been shown to be quite effective for speech recognition, _
4 - 11 - 3.11 Text Categorization- Discriminative Classifier Part 2 (00-31-46).srt,362,1583.3,1587.62,_computer reasoning, and recently has been applied to text as well. _
4 - 11 - 3.11 Text Categorization- Discriminative Classifier Part 2 (00-31-46).srt,363,1587.62,1589.53,It has shown some promise. 
4 - 11 - 3.11 Text Categorization- Discriminative Classifier Part 2 (00-31-46).srt,364,1589.53,1593.01,And one important advantage of this approach in 
4 - 11 - 3.11 Text Categorization- Discriminative Classifier Part 2 (00-31-46).srt,365,1594.27,1599.01,_relationship with the featured design, is that they can _
4 - 11 - 3.11 Text Categorization- Discriminative Classifier Part 2 (00-31-46).srt,366,1599.01,1603.92,learn intermediate replantations or compound the features automatically. 
4 - 11 - 3.11 Text Categorization- Discriminative Classifier Part 2 (00-31-46).srt,367,1603.92,1609.193,_And this is very valuable for learning effective replantation, _
4 - 11 - 3.11 Text Categorization- Discriminative Classifier Part 2 (00-31-46).srt,368,1609.193,1611.66,for text recalibration. 
4 - 11 - 3.11 Text Categorization- Discriminative Classifier Part 2 (00-31-46).srt,369,1611.66,1617.39,_Although in text domain, because words are exemplary representation of text content, _
4 - 11 - 3.11 Text Categorization- Discriminative Classifier Part 2 (00-31-46).srt,370,1617.39,1621.62,because these are human's imaging for communication. 
4 - 11 - 3.11 Text Categorization- Discriminative Classifier Part 2 (00-31-46).srt,371,1621.62,1628.16,And they are generally sufficient for For representing content for many tasks. 
4 - 11 - 3.11 Text Categorization- Discriminative Classifier Part 2 (00-31-46).srt,372,1628.16,1631.43,_If there's a need for some new representation, _
4 - 11 - 3.11 Text Categorization- Discriminative Classifier Part 2 (00-31-46).srt,373,1631.43,1635.25,people would have invented a new word. 
4 - 11 - 3.11 Text Categorization- Discriminative Classifier Part 2 (00-31-46).srt,374,1635.25,1638.32,So because of this we think of value of deep learning for 
4 - 11 - 3.11 Text Categorization- Discriminative Classifier Part 2 (00-31-46).srt,375,1638.32,1642.61,text processing tends to be lower than for [INAUDIBLE]. 
4 - 11 - 3.11 Text Categorization- Discriminative Classifier Part 2 (00-31-46).srt,376,1642.61,1646.49,And the speech revenue where they are anchored corresponding 
4 - 11 - 3.11 Text Categorization- Discriminative Classifier Part 2 (00-31-46).srt,377,1646.49,1649.92,where the design that worked as features. 
4 - 11 - 3.11 Text Categorization- Discriminative Classifier Part 2 (00-31-46).srt,378,1651.16,1655.02,But people only still very promising for learning effective features especially for 
4 - 11 - 3.11 Text Categorization- Discriminative Classifier Part 2 (00-31-46).srt,379,1655.02,1655.857,complicated tasks. 
4 - 11 - 3.11 Text Categorization- Discriminative Classifier Part 2 (00-31-46).srt,380,1655.857,1659.85,Like a analysis it has been shown to be effective 
4 - 11 - 3.11 Text Categorization- Discriminative Classifier Part 2 (00-31-46).srt,381,1661.23,1664.76,because it can provide that goes beyond that of words. 
4 - 11 - 3.11 Text Categorization- Discriminative Classifier Part 2 (00-31-46).srt,382,1667.03,1670.24,Now regarding the training examples. 
4 - 11 - 3.11 Text Categorization- Discriminative Classifier Part 2 (00-31-46).srt,383,1670.24,1673.94,It's generally hard to get a lot of training examples because it involves 
4 - 11 - 3.11 Text Categorization- Discriminative Classifier Part 2 (00-31-46).srt,384,1673.94,1674.56,human labor. 
4 - 11 - 3.11 Text Categorization- Discriminative Classifier Part 2 (00-31-46).srt,385,1676.31,1678.57,But there are also some ways to help with this. 
4 - 11 - 3.11 Text Categorization- Discriminative Classifier Part 2 (00-31-46).srt,386,1678.57,1684.83,So one is to assume in some low quality training examples can also be used. 
4 - 11 - 3.11 Text Categorization- Discriminative Classifier Part 2 (00-31-46).srt,387,1684.83,1687.8,_So, those can be called pseudo training examples. _
4 - 11 - 3.11 Text Categorization- Discriminative Classifier Part 2 (00-31-46).srt,388,1687.8,1693.22,_For example, if you take reviews from the internet, they might have overall ratings. _
4 - 11 - 3.11 Text Categorization- Discriminative Classifier Part 2 (00-31-46).srt,389,1693.22,1701.25,_So, to train a of categorizer, meaning we want to positive or negative. _
4 - 11 - 3.11 Text Categorization- Discriminative Classifier Part 2 (00-31-46).srt,390,1701.25,1704.86,And categorize these reviews into these two categories. 
4 - 11 - 3.11 Text Categorization- Discriminative Classifier Part 2 (00-31-46).srt,391,1704.86,1711.57,Then we could assume five star reviews are all positive training samples. 
4 - 11 - 3.11 Text Categorization- Discriminative Classifier Part 2 (00-31-46).srt,392,1711.57,1713.27,One star are negative. 
4 - 11 - 3.11 Text Categorization- Discriminative Classifier Part 2 (00-31-46).srt,393,1713.27,1714.19,_But of course, _
4 - 11 - 3.11 Text Categorization- Discriminative Classifier Part 2 (00-31-46).srt,394,1714.19,1718.52,sometimes even five star reviews will also mention negative opinions so the training 
4 - 11 - 3.11 Text Categorization- Discriminative Classifier Part 2 (00-31-46).srt,395,1718.52,1723.18,_sample is not all of that high quality, but they can still be useful. _
4 - 11 - 3.11 Text Categorization- Discriminative Classifier Part 2 (00-31-46).srt,396,1725.2,1727.97,Another idea is to exploit the unlabeled data and 
4 - 11 - 3.11 Text Categorization- Discriminative Classifier Part 2 (00-31-46).srt,397,1727.97,1730.83,there are techniques called the semi-supervised machine 
4 - 11 - 3.11 Text Categorization- Discriminative Classifier Part 2 (00-31-46).srt,398,1730.83,1735.685,learning techniques that can allow you to combine labeled data with unlabeled data. 
4 - 11 - 3.11 Text Categorization- Discriminative Classifier Part 2 (00-31-46).srt,399,1735.685,1741.07,_So, in other case it's easy to see the next model can be used For _
4 - 11 - 3.11 Text Categorization- Discriminative Classifier Part 2 (00-31-46).srt,400,1741.07,1743.76,both text plus read and the categorization. 
4 - 11 - 3.11 Text Categorization- Discriminative Classifier Part 2 (00-31-46).srt,401,1743.76,1749.22,_So you can imagine, if you have a lot of unlabeled text data for categorization, _
4 - 11 - 3.11 Text Categorization- Discriminative Classifier Part 2 (00-31-46).srt,402,1749.22,1755.62,_then you can actually do clustering on these text data, learn categories. _
4 - 11 - 3.11 Text Categorization- Discriminative Classifier Part 2 (00-31-46).srt,403,1755.62,1758.088,And then try to somehow align these categories. 
4 - 11 - 3.11 Text Categorization- Discriminative Classifier Part 2 (00-31-46).srt,404,1758.088,1763.23,_With the categories defined by the training data, _
4 - 11 - 3.11 Text Categorization- Discriminative Classifier Part 2 (00-31-46).srt,405,1763.23,1766.39,where we already know which documents are in which category. 
4 - 11 - 3.11 Text Categorization- Discriminative Classifier Part 2 (00-31-46).srt,406,1766.39,1771.62,So you can in fact use the Algorithm to actually combine both. 
4 - 11 - 3.11 Text Categorization- Discriminative Classifier Part 2 (00-31-46).srt,407,1771.62,1777.39,That would allow you essentially also pick up useful words and label the data. 
4 - 11 - 3.11 Text Categorization- Discriminative Classifier Part 2 (00-31-46).srt,408,1777.39,1779.32,You can think of this in another way. 
4 - 11 - 3.11 Text Categorization- Discriminative Classifier Part 2 (00-31-46).srt,409,1779.32,1783.804,_Basically, we can use let's say a to _
4 - 11 - 3.11 Text Categorization- Discriminative Classifier Part 2 (00-31-46).srt,410,1783.804,1788.48,_classify all of the unlabeled text documents, and then we're going to _
4 - 11 - 3.11 Text Categorization- Discriminative Classifier Part 2 (00-31-46).srt,411,1788.48,1794.04,assume the high confidence Classification results are actually liable. 
4 - 11 - 3.11 Text Categorization- Discriminative Classifier Part 2 (00-31-46).srt,412,1794.04,1798.6,Then you suddenly have more training data because from the enabler that we 
4 - 11 - 3.11 Text Categorization- Discriminative Classifier Part 2 (00-31-46).srt,413,1798.6,1803.45,_now know some are labeled as category one, some are labeled as category two. _
4 - 11 - 3.11 Text Categorization- Discriminative Classifier Part 2 (00-31-46).srt,414,1803.45,1806.38,All though the label is not completely reliable But 
4 - 11 - 3.11 Text Categorization- Discriminative Classifier Part 2 (00-31-46).srt,415,1806.38,1807.83,then they can still be useful. 
4 - 11 - 3.11 Text Categorization- Discriminative Classifier Part 2 (00-31-46).srt,416,1807.83,1814.72,_So let's assume they are actually training label examples, and then we combine them _
4 - 11 - 3.11 Text Categorization- Discriminative Classifier Part 2 (00-31-46).srt,417,1814.72,1819.94,with true training examples through improved categorization method. 
4 - 11 - 3.11 Text Categorization- Discriminative Classifier Part 2 (00-31-46).srt,418,1819.94,1822.11,And so this idea is very powerful. 
4 - 11 - 3.11 Text Categorization- Discriminative Classifier Part 2 (00-31-46).srt,419,1823.98,1828.28,_When the enabled data and the training data are very different, and _
4 - 11 - 3.11 Text Categorization- Discriminative Classifier Part 2 (00-31-46).srt,420,1828.28,1832.41,we might need to use other advanced machine learning techniques 
4 - 11 - 3.11 Text Categorization- Discriminative Classifier Part 2 (00-31-46).srt,421,1832.41,1835.15,called domain adaptation or transfer learning. 
4 - 11 - 3.11 Text Categorization- Discriminative Classifier Part 2 (00-31-46).srt,422,1835.15,1837.58,This is when we can 
4 - 11 - 3.11 Text Categorization- Discriminative Classifier Part 2 (00-31-46).srt,423,1837.58,1842.45,Borrow some training examples from a related problem that may be different. 
4 - 11 - 3.11 Text Categorization- Discriminative Classifier Part 2 (00-31-46).srt,424,1842.45,1844.47,_Or, from a categorization password _
4 - 11 - 3.11 Text Categorization- Discriminative Classifier Part 2 (00-31-46).srt,425,1846.78,1852.13,that follow very different distribution from what we are working on. 
4 - 11 - 3.11 Text Categorization- Discriminative Classifier Part 2 (00-31-46).srt,426,1852.13,1854.19,_But basically, when the two domains are very different, _
4 - 11 - 3.11 Text Categorization- Discriminative Classifier Part 2 (00-31-46).srt,427,1854.19,1857.64,then we need to be careful and not overfit the training domain. 
4 - 11 - 3.11 Text Categorization- Discriminative Classifier Part 2 (00-31-46).srt,428,1857.64,1862.3,_But yet, we can still want to use some signals from the related training data. _
4 - 11 - 3.11 Text Categorization- Discriminative Classifier Part 2 (00-31-46).srt,429,1862.3,1867.27,_So for example, training categorization on news might not _
4 - 11 - 3.11 Text Categorization- Discriminative Classifier Part 2 (00-31-46).srt,430,1867.27,1872.41,give you Effective plus y for class vine topics and tweets. 
4 - 11 - 3.11 Text Categorization- Discriminative Classifier Part 2 (00-31-46).srt,431,1872.41,1879.49,But you can still learn something from news to help look at writing tweets. 
4 - 11 - 3.11 Text Categorization- Discriminative Classifier Part 2 (00-31-46).srt,432,1879.49,1885.47,So there are mission learning techniques that can help you do that effectively. 
4 - 11 - 3.11 Text Categorization- Discriminative Classifier Part 2 (00-31-46).srt,433,1885.47,1890.259,Here's a suggested reading where you can find more details about some 
4 - 11 - 3.11 Text Categorization- Discriminative Classifier Part 2 (00-31-46).srt,434,1890.259,1893.271,more of the methods is that we have covered. 
