name,id,from,to,text
4 - 11 - 3.11 Text Categorization- Discriminative Classifier Part 2 (00-31-46).srt,1,7.29,11.068,[SOUND] This lecture is a continued discussion of 
4 - 11 - 3.11 Text Categorization- Discriminative Classifier Part 2 (00-31-46).srt,2,11.068,15.61,Discriminative Classifiers for Text Categorization. 
4 - 11 - 3.11 Text Categorization- Discriminative Classifier Part 2 (00-31-46).srt,3,15.61,18.096,_So, in this lecture, we're going to introduce, yet _
4 - 11 - 3.11 Text Categorization- Discriminative Classifier Part 2 (00-31-46).srt,4,18.096,22.45,another Discriminative Classifier called the Support Vector Machine or SVM. 
4 - 11 - 3.11 Text Categorization- Discriminative Classifier Part 2 (00-31-46).srt,5,22.45,25.05,Which is a very popular classification method and 
4 - 11 - 3.11 Text Categorization- Discriminative Classifier Part 2 (00-31-46).srt,6,25.05,28.79,it has been also shown to be effective for text categorization. 
4 - 11 - 3.11 Text Categorization- Discriminative Classifier Part 2 (00-31-46).srt,7,31.35,34.38,_So to introduce this classifier, _
4 - 11 - 3.11 Text Categorization- Discriminative Classifier Part 2 (00-31-46).srt,8,34.38,38.06,let's also think about the simple case of two categories. 
4 - 11 - 3.11 Text Categorization- Discriminative Classifier Part 2 (00-31-46).srt,9,38.06,43.3,_We have two topic categories, 01 and 02 here. _
4 - 11 - 3.11 Text Categorization- Discriminative Classifier Part 2 (00-31-46).srt,10,43.3,47.76,And we want to classify documents into these two categories and 
4 - 11 - 3.11 Text Categorization- Discriminative Classifier Part 2 (00-31-46).srt,11,47.76,51.82,we're going to represent again a document by a feature factor x here. 
4 - 11 - 3.11 Text Categorization- Discriminative Classifier Part 2 (00-31-46).srt,12,53.2,58.02,_Now, the idea of this classifier is to design also a linear separator _
4 - 11 - 3.11 Text Categorization- Discriminative Classifier Part 2 (00-31-46).srt,13,59.15,61.36,here that you'll see and 
4 - 11 - 3.11 Text Categorization- Discriminative Classifier Part 2 (00-31-46).srt,14,61.36,65.82,_it's very similar to what you have seen not just for regression, right? _
4 - 11 - 3.11 Text Categorization- Discriminative Classifier Part 2 (00-31-46).srt,15,65.82,71.24,And we're going to do also say that if the sign of this function 
4 - 11 - 3.11 Text Categorization- Discriminative Classifier Part 2 (00-31-46).srt,16,71.24,76.69,value is positive then we're going to say the objective is in category one. 
4 - 11 - 3.11 Text Categorization- Discriminative Classifier Part 2 (00-31-46).srt,17,76.69,80.47,_Otherwise, we're going to say it's in category 2. _
4 - 11 - 3.11 Text Categorization- Discriminative Classifier Part 2 (00-31-46).srt,18,80.47,87.7,So that makes 0 that is the decision boundary between the few categories. 
4 - 11 - 3.11 Text Categorization- Discriminative Classifier Part 2 (00-31-46).srt,19,88.83,93.99000000000001,_So, in generally hiding marginal space such as, 0. _
4 - 11 - 3.11 Text Categorization- Discriminative Classifier Part 2 (00-31-46).srt,20,93.99000000000001,97.07,corresponds to a hyper plain. 
4 - 11 - 3.11 Text Categorization- Discriminative Classifier Part 2 (00-31-46).srt,21,98.21000000000001,103.18,Now I've shown you a simple case of two dimensional space it was just X1 and 
4 - 11 - 3.11 Text Categorization- Discriminative Classifier Part 2 (00-31-46).srt,22,103.18,109.91,X2 and this case this corresponds to a line that you can see here. 
4 - 11 - 3.11 Text Categorization- Discriminative Classifier Part 2 (00-31-46).srt,23,111.22,115.97999999999999,_So, this is a line defined by _
4 - 11 - 3.11 Text Categorization- Discriminative Classifier Part 2 (00-31-46).srt,24,115.97999999999999,120.97,_just three parameters here, beta zero, beta one, and beta two. _
4 - 11 - 3.11 Text Categorization- Discriminative Classifier Part 2 (00-31-46).srt,25,122.39,127.32,_Now, this line is heading in this direction so _
4 - 11 - 3.11 Text Categorization- Discriminative Classifier Part 2 (00-31-46).srt,26,127.32,133.45,_it shows that as we increase X1, X2 will also increase. _
4 - 11 - 3.11 Text Categorization- Discriminative Classifier Part 2 (00-31-46).srt,27,133.45,137.78,_So we know that beta one and beta two have different assigns, one is negative and _
4 - 11 - 3.11 Text Categorization- Discriminative Classifier Part 2 (00-31-46).srt,28,137.78,138.92000000000002,the other is positive. 
4 - 11 - 3.11 Text Categorization- Discriminative Classifier Part 2 (00-31-46).srt,29,140.8,146.79,So let's just assume that beta one is negative and beta two Is positive. 
4 - 11 - 3.11 Text Categorization- Discriminative Classifier Part 2 (00-31-46).srt,30,148.81,151.25,_Now, it's interesting to examine, then, _
4 - 11 - 3.11 Text Categorization- Discriminative Classifier Part 2 (00-31-46).srt,31,151.25,154.8,the data instances on the two sides of the slide. 
4 - 11 - 3.11 Text Categorization- Discriminative Classifier Part 2 (00-31-46).srt,32,154.8,159.69,_So, here, the data instance are visualized as circles for one class and _
4 - 11 - 3.11 Text Categorization- Discriminative Classifier Part 2 (00-31-46).srt,33,159.69,161.8,diamonds for the other class. 
4 - 11 - 3.11 Text Categorization- Discriminative Classifier Part 2 (00-31-46).srt,34,163.14,169.09,_Now, one question is to take a point like this one and to ask the question _
4 - 11 - 3.11 Text Categorization- Discriminative Classifier Part 2 (00-31-46).srt,35,169.09,174.11,_what's the value of this expression, or this classifier, for this data point? _
4 - 11 - 3.11 Text Categorization- Discriminative Classifier Part 2 (00-31-46).srt,36,175.35,177.0,So what do you think? 
4 - 11 - 3.11 Text Categorization- Discriminative Classifier Part 2 (00-31-46).srt,37,177.0,180.65,_Basically, we're going to evaluate its value by using this function. _
4 - 11 - 3.11 Text Categorization- Discriminative Classifier Part 2 (00-31-46).srt,38,181.74,186.19,_And as we said, if this value's positive we're going to say this is in category _
4 - 11 - 3.11 Text Categorization- Discriminative Classifier Part 2 (00-31-46).srt,39,186.19,189.61,_one, and if it's negative, it's going to be in category two. _
4 - 11 - 3.11 Text Categorization- Discriminative Classifier Part 2 (00-31-46).srt,40,189.61,195.343,_Intuitively, this line separates these two categories, so we expect the points on _
4 - 11 - 3.11 Text Categorization- Discriminative Classifier Part 2 (00-31-46).srt,41,195.343,199.87,one side would be positive and the points on the other side would be negative. 
4 - 11 - 3.11 Text Categorization- Discriminative Classifier Part 2 (00-31-46).srt,42,199.87,203.2,_Our question is under the assumption that I just mentioned, _
4 - 11 - 3.11 Text Categorization- Discriminative Classifier Part 2 (00-31-46).srt,43,203.2,205.32,let's examine a particular point like this one. 
4 - 11 - 3.11 Text Categorization- Discriminative Classifier Part 2 (00-31-46).srt,44,207.59,210.48,So what do you think is the sine of this expression? 
4 - 11 - 3.11 Text Categorization- Discriminative Classifier Part 2 (00-31-46).srt,45,211.61,217.82999999999998,_Well, to examine the sine we can simply look at this expression here. _
4 - 11 - 3.11 Text Categorization- Discriminative Classifier Part 2 (00-31-46).srt,46,217.82999999999998,220.95,_And we can compare this with let's say, _
4 - 11 - 3.11 Text Categorization- Discriminative Classifier Part 2 (00-31-46).srt,47,222.05,226.95,_value on the line, let's see, compare this with this point. _
4 - 11 - 3.11 Text Categorization- Discriminative Classifier Part 2 (00-31-46).srt,48,228.44,233.52,_While they have identical X1, but then one has a higher value for X2. _
4 - 11 - 3.11 Text Categorization- Discriminative Classifier Part 2 (00-31-46).srt,49,234.74,239.79,_Now, let's look at the sin of the coefficient for X2. _
4 - 11 - 3.11 Text Categorization- Discriminative Classifier Part 2 (00-31-46).srt,50,239.79,241.61,_Well, we know this is a positive. _
4 - 11 - 3.11 Text Categorization- Discriminative Classifier Part 2 (00-31-46).srt,51,242.85,246.26,_So, what that means is that the f value for _
4 - 11 - 3.11 Text Categorization- Discriminative Classifier Part 2 (00-31-46).srt,52,246.26,250.4,this point should be higher than the f value for 
4 - 11 - 3.11 Text Categorization- Discriminative Classifier Part 2 (00-31-46).srt,53,250.4,254.8,_this point on the line that means this will be positive, right? _
4 - 11 - 3.11 Text Categorization- Discriminative Classifier Part 2 (00-31-46).srt,54,256.19,259.9,_So we know in general of all points on this side, _
4 - 11 - 3.11 Text Categorization- Discriminative Classifier Part 2 (00-31-46).srt,55,260.96,265.38,the function's value will be positive and 
4 - 11 - 3.11 Text Categorization- Discriminative Classifier Part 2 (00-31-46).srt,56,265.38,269.38,you can also verify all the points on this side will be negative. 
4 - 11 - 3.11 Text Categorization- Discriminative Classifier Part 2 (00-31-46).srt,57,269.38,271.75,And so this is how this kind of linear classifier or 
4 - 11 - 3.11 Text Categorization- Discriminative Classifier Part 2 (00-31-46).srt,58,271.75,275.94,linear separator can then separate the points in the two categories. 
4 - 11 - 3.11 Text Categorization- Discriminative Classifier Part 2 (00-31-46).srt,59,277.81,282.83,_So, now the natural question is, which linear separator is the best? _
4 - 11 - 3.11 Text Categorization- Discriminative Classifier Part 2 (00-31-46).srt,60,282.83,287.687,_Now, I've get you one line here that can separate the two classes. _
4 - 11 - 3.11 Text Categorization- Discriminative Classifier Part 2 (00-31-46).srt,61,287.687,293.19,_And this line, of course, is determined by the vector beta, the coefficients. _
4 - 11 - 3.11 Text Categorization- Discriminative Classifier Part 2 (00-31-46).srt,62,293.19,295.21,Different coefficients will give us different lines. 
4 - 11 - 3.11 Text Categorization- Discriminative Classifier Part 2 (00-31-46).srt,63,295.21,298.77,_So, we could imagine there are other lines that can do the same job. _
4 - 11 - 3.11 Text Categorization- Discriminative Classifier Part 2 (00-31-46).srt,64,298.77,300.63,_Gamma, for example, _
4 - 11 - 3.11 Text Categorization- Discriminative Classifier Part 2 (00-31-46).srt,65,300.63,304.86,could give us another line that counts a separator to these instances. 
4 - 11 - 3.11 Text Categorization- Discriminative Classifier Part 2 (00-31-46).srt,66,306.01,309.71,_Of course, there are also lines that won't separate to them and those are bad lines. _
4 - 11 - 3.11 Text Categorization- Discriminative Classifier Part 2 (00-31-46).srt,67,309.71,312.31,_But, the question is, when we have multiple lines that can _
4 - 11 - 3.11 Text Categorization- Discriminative Classifier Part 2 (00-31-46).srt,68,312.31,315.95,_separate both clauses, which align the best? _
4 - 11 - 3.11 Text Categorization- Discriminative Classifier Part 2 (00-31-46).srt,69,315.95,321.74,_In fact, you can imagine, there are many different ways of choosing the line. _
4 - 11 - 3.11 Text Categorization- Discriminative Classifier Part 2 (00-31-46).srt,70,321.74,327.31,_So, the logistical regression classifier that you have seen earlier actually uses _
4 - 11 - 3.11 Text Categorization- Discriminative Classifier Part 2 (00-31-46).srt,71,327.31,333.06,some criteria to determine where this line should be and so linear separate as well. 
4 - 11 - 3.11 Text Categorization- Discriminative Classifier Part 2 (00-31-46).srt,72,333.06,336.61,And uses a conditional likelihood on the training that it determines 
4 - 11 - 3.11 Text Categorization- Discriminative Classifier Part 2 (00-31-46).srt,73,336.61,338.31,which line is the best. 
4 - 11 - 3.11 Text Categorization- Discriminative Classifier Part 2 (00-31-46).srt,74,338.31,341.13,But in SVM we're going to look at another criteria for 
4 - 11 - 3.11 Text Categorization- Discriminative Classifier Part 2 (00-31-46).srt,75,341.13,343.5,determining which line is the best. 
4 - 11 - 3.11 Text Categorization- Discriminative Classifier Part 2 (00-31-46).srt,76,343.5,344.23,_And this time, _
4 - 11 - 3.11 Text Categorization- Discriminative Classifier Part 2 (00-31-46).srt,77,344.23,348.3,the criteria is more tied to the classification arrow as you will see. 
4 - 11 - 3.11 Text Categorization- Discriminative Classifier Part 2 (00-31-46).srt,78,349.46,356.12,_So, the basic idea is to choose the separator to maximize the margin. _
4 - 11 - 3.11 Text Categorization- Discriminative Classifier Part 2 (00-31-46).srt,79,356.12,357.18,So what is a margin? 
4 - 11 - 3.11 Text Categorization- Discriminative Classifier Part 2 (00-31-46).srt,80,357.18,363.54,_So, I choose some dotted lines here to indicate _
4 - 11 - 3.11 Text Categorization- Discriminative Classifier Part 2 (00-31-46).srt,81,363.54,369.02,the boundaries of those data points in each class. 
4 - 11 - 3.11 Text Categorization- Discriminative Classifier Part 2 (00-31-46).srt,82,369.02,373.89,_And the margin is simply the distance between the line, _
4 - 11 - 3.11 Text Categorization- Discriminative Classifier Part 2 (00-31-46).srt,83,373.89,377.42,_the separator, and the closest point from each class. _
4 - 11 - 3.11 Text Categorization- Discriminative Classifier Part 2 (00-31-46).srt,84,378.49,383.83,So you can see the margin of this side is as I've shown here and 
4 - 11 - 3.11 Text Categorization- Discriminative Classifier Part 2 (00-31-46).srt,85,383.83,385.81,you can also define the margin on the other side. 
4 - 11 - 3.11 Text Categorization- Discriminative Classifier Part 2 (00-31-46).srt,86,387.02,391.19,_In order for the separator to maximize the margin, _
4 - 11 - 3.11 Text Categorization- Discriminative Classifier Part 2 (00-31-46).srt,87,391.19,395.7,it has to be kind of in the middle of the two boundaries and 
4 - 11 - 3.11 Text Categorization- Discriminative Classifier Part 2 (00-31-46).srt,88,395.7,400.05,_you don't want this separator to be very close to one side, and _
4 - 11 - 3.11 Text Categorization- Discriminative Classifier Part 2 (00-31-46).srt,89,400.05,402.8,that in intuition makes a lot of sense. 
4 - 11 - 3.11 Text Categorization- Discriminative Classifier Part 2 (00-31-46).srt,90,404.46,407.05,So this is basic idea of SVM. 
4 - 11 - 3.11 Text Categorization- Discriminative Classifier Part 2 (00-31-46).srt,91,407.05,410.02,We're going to choose a linear separator to maximize the margin. 
4 - 11 - 3.11 Text Categorization- Discriminative Classifier Part 2 (00-31-46).srt,92,412.13,415.45,_Now on this slide, I've also changed the notation so _
4 - 11 - 3.11 Text Categorization- Discriminative Classifier Part 2 (00-31-46).srt,93,415.45,418.46,that I'm not going to use beta to denote the parameters. 
4 - 11 - 3.11 Text Categorization- Discriminative Classifier Part 2 (00-31-46).srt,94,418.46,423.74,_But instead, I'm going to use w although w was used to denote the words before so _
4 - 11 - 3.11 Text Categorization- Discriminative Classifier Part 2 (00-31-46).srt,95,423.74,425.37,don't be confused here. 
4 - 11 - 3.11 Text Categorization- Discriminative Classifier Part 2 (00-31-46).srt,96,425.37,429.618,_W here is actually a width, a certain width. _
4 - 11 - 3.11 Text Categorization- Discriminative Classifier Part 2 (00-31-46).srt,97,432.734,439.03,_So I'm also using lowercase b to denote the beta 0, a biased constant. _
4 - 11 - 3.11 Text Categorization- Discriminative Classifier Part 2 (00-31-46).srt,98,440.03,444.1,And there are instances do represent that as x and 
4 - 11 - 3.11 Text Categorization- Discriminative Classifier Part 2 (00-31-46).srt,99,444.1,448.79,I also use the vector form of multiplication here. 
4 - 11 - 3.11 Text Categorization- Discriminative Classifier Part 2 (00-31-46).srt,100,448.79,454.11,So we see a transpose of w vector multiply by the future vector. 
4 - 11 - 3.11 Text Categorization- Discriminative Classifier Part 2 (00-31-46).srt,101,455.29,462.08,So b is a bias constant and w is a set of weights with one way for each feature. 
4 - 11 - 3.11 Text Categorization- Discriminative Classifier Part 2 (00-31-46).srt,102,462.08,465.26,We have m features and so we have m weights and 
4 - 11 - 3.11 Text Categorization- Discriminative Classifier Part 2 (00-31-46).srt,103,465.26,466.42,that will represent as a vector. 
4 - 11 - 3.11 Text Categorization- Discriminative Classifier Part 2 (00-31-46).srt,104,467.64,471.26,_And similarly, the data instance here, the text object, _
4 - 11 - 3.11 Text Categorization- Discriminative Classifier Part 2 (00-31-46).srt,105,471.26,475.94,is represented by also a feature vector of the same number of elements. 
4 - 11 - 3.11 Text Categorization- Discriminative Classifier Part 2 (00-31-46).srt,106,475.94,479.1,Xi is a feature value. 
4 - 11 - 3.11 Text Categorization- Discriminative Classifier Part 2 (00-31-46).srt,107,479.1,484.418,_For example, word count and you can verify, when we. _
4 - 11 - 3.11 Text Categorization- Discriminative Classifier Part 2 (00-31-46).srt,108,484.418,488.96,_Multiply these two vectors together, take the dot product, _
4 - 11 - 3.11 Text Categorization- Discriminative Classifier Part 2 (00-31-46).srt,109,488.96,494.335,we get the same form of the linear separator as you have seen before. 
4 - 11 - 3.11 Text Categorization- Discriminative Classifier Part 2 (00-31-46).srt,110,494.335,496.713,It's just a different way of representing this. 
4 - 11 - 3.11 Text Categorization- Discriminative Classifier Part 2 (00-31-46).srt,111,496.713,501.267,Now I use this way so that it's more consistent with what notations 
4 - 11 - 3.11 Text Categorization- Discriminative Classifier Part 2 (00-31-46).srt,112,501.267,504.75,people usually use when they talk about SVM. 
4 - 11 - 3.11 Text Categorization- Discriminative Classifier Part 2 (00-31-46).srt,113,504.75,509.47,This way you can better connect the slides with some other readings you might do. 
4 - 11 - 3.11 Text Categorization- Discriminative Classifier Part 2 (00-31-46).srt,114,511.19,519.78,_Okay, so when we maximize the margins of a separator, _
4 - 11 - 3.11 Text Categorization- Discriminative Classifier Part 2 (00-31-46).srt,115,519.78,524.73,it just means the boundary of the separator is only determined by 
4 - 11 - 3.11 Text Categorization- Discriminative Classifier Part 2 (00-31-46).srt,116,524.73,529.8,_a few data points, and these are the data points that we call support vectors. _
4 - 11 - 3.11 Text Categorization- Discriminative Classifier Part 2 (00-31-46).srt,117,529.8,534.6,So here illustrated are two support vectors for one class and two for 
4 - 11 - 3.11 Text Categorization- Discriminative Classifier Part 2 (00-31-46).srt,118,534.6,536.22,the other class. 
4 - 11 - 3.11 Text Categorization- Discriminative Classifier Part 2 (00-31-46).srt,119,536.22,540.9,_And these quotas define the margin basically, and _
4 - 11 - 3.11 Text Categorization- Discriminative Classifier Part 2 (00-31-46).srt,120,540.9,545.35,you can imagine once we know which are supportive vectors then this 
4 - 11 - 3.11 Text Categorization- Discriminative Classifier Part 2 (00-31-46).srt,121,546.43,549.75,center separator line will be determined by them. 
4 - 11 - 3.11 Text Categorization- Discriminative Classifier Part 2 (00-31-46).srt,122,549.75,556.32,So the other data points actually don't really matter that much. 
4 - 11 - 3.11 Text Categorization- Discriminative Classifier Part 2 (00-31-46).srt,123,556.32,560.42,And you can see if you change the other data points it won't really affect 
4 - 11 - 3.11 Text Categorization- Discriminative Classifier Part 2 (00-31-46).srt,124,560.42,562.905,_the margin, so the separator will stay the same. _
4 - 11 - 3.11 Text Categorization- Discriminative Classifier Part 2 (00-31-46).srt,125,562.905,566.514,Mainly affected by the the support vector machines. 
4 - 11 - 3.11 Text Categorization- Discriminative Classifier Part 2 (00-31-46).srt,126,566.514,569.705,_Sorry, it's mainly affected by the support vectors and _
4 - 11 - 3.11 Text Categorization- Discriminative Classifier Part 2 (00-31-46).srt,127,569.705,572.639,that's why it's called a support vector machine. 
4 - 11 - 3.11 Text Categorization- Discriminative Classifier Part 2 (00-31-46).srt,128,572.639,577.968,_Okay, so now the next question is, of course, _
4 - 11 - 3.11 Text Categorization- Discriminative Classifier Part 2 (00-31-46).srt,129,577.968,582.73,how can we set it up to optimize the line? 
4 - 11 - 3.11 Text Categorization- Discriminative Classifier Part 2 (00-31-46).srt,130,582.73,587.43,How can we actually find the line or the separator? 
4 - 11 - 3.11 Text Categorization- Discriminative Classifier Part 2 (00-31-46).srt,131,587.43,591.39,Now this is equivalent to finding values for w and 
4 - 11 - 3.11 Text Categorization- Discriminative Classifier Part 2 (00-31-46).srt,132,591.39,595.779,_b, because they will determine where exactly the separator is. _
4 - 11 - 3.11 Text Categorization- Discriminative Classifier Part 2 (00-31-46).srt,133,598.01,604.7,_So in the simplest case, the linear SVM is just a simple optimization problem. _
4 - 11 - 3.11 Text Categorization- Discriminative Classifier Part 2 (00-31-46).srt,134,604.7,610.23,_So again, let's recall that our classifier is such a linear separator, where we _
4 - 11 - 3.11 Text Categorization- Discriminative Classifier Part 2 (00-31-46).srt,135,610.23,615.98,_have weights for all the features, and the main goal is remove these weights w and b. _
4 - 11 - 3.11 Text Categorization- Discriminative Classifier Part 2 (00-31-46).srt,136,615.98,621.04,And the classifier will say X is in category theta 1 if it's positive. 
4 - 11 - 3.11 Text Categorization- Discriminative Classifier Part 2 (00-31-46).srt,137,621.04,623.95,_Otherwise, it's going to say it's in the other category. _
4 - 11 - 3.11 Text Categorization- Discriminative Classifier Part 2 (00-31-46).srt,138,623.95,627.22,_So this is our assumption, our setup. _
4 - 11 - 3.11 Text Categorization- Discriminative Classifier Part 2 (00-31-46).srt,139,627.22,632.406,_So in the linear SVM, we are going to then seek these parameter _
4 - 11 - 3.11 Text Categorization- Discriminative Classifier Part 2 (00-31-46).srt,140,632.406,637.51,values to optimize the margins and then the training error. 
4 - 11 - 3.11 Text Categorization- Discriminative Classifier Part 2 (00-31-46).srt,141,638.8,641.92,The training data would be basically like in other classifiers. 
4 - 11 - 3.11 Text Categorization- Discriminative Classifier Part 2 (00-31-46).srt,142,641.92,645.94,_We have a set of training points where we know the x vector, and _
4 - 11 - 3.11 Text Categorization- Discriminative Classifier Part 2 (00-31-46).srt,143,645.94,650.29,_then we also know the corresponding label, y i. _
4 - 11 - 3.11 Text Categorization- Discriminative Classifier Part 2 (00-31-46).srt,144,650.29,654.31,_And here we define y i as two values, but _
4 - 11 - 3.11 Text Categorization- Discriminative Classifier Part 2 (00-31-46).srt,145,654.31,658.358,_these values are not 0, 1 as you have seen before, but rather -1 and _
4 - 11 - 3.11 Text Categorization- Discriminative Classifier Part 2 (00-31-46).srt,146,658.358,663.99,_positive 1, and they're corresponding to these two categories, as I've shown here. _
4 - 11 - 3.11 Text Categorization- Discriminative Classifier Part 2 (00-31-46).srt,147,663.99,668.33,Now you might wonder why we don't define them as 0 and 
4 - 11 - 3.11 Text Categorization- Discriminative Classifier Part 2 (00-31-46).srt,148,668.33,671.77,_1 instead of having -1, 1. _
4 - 11 - 3.11 Text Categorization- Discriminative Classifier Part 2 (00-31-46).srt,149,671.77,675.52,_And this is purely for mathematical convenience, as you will see in a moment. _
4 - 11 - 3.11 Text Categorization- Discriminative Classifier Part 2 (00-31-46).srt,150,676.7,679.45,So the goal of optimization first is 
4 - 11 - 3.11 Text Categorization- Discriminative Classifier Part 2 (00-31-46).srt,151,679.45,683.7,to make sure the labeling of training data is all correct. 
4 - 11 - 3.11 Text Categorization- Discriminative Classifier Part 2 (00-31-46).srt,152,683.7,688.24,_So that just means if y i, the norm label for instance x i, _
4 - 11 - 3.11 Text Categorization- Discriminative Classifier Part 2 (00-31-46).srt,153,688.24,693.61,_is 1, we would like this classified value to be large. _
4 - 11 - 3.11 Text Categorization- Discriminative Classifier Part 2 (00-31-46).srt,154,693.61,696.74,And here we just choose a threshold of 1 here. 
4 - 11 - 3.11 Text Categorization- Discriminative Classifier Part 2 (00-31-46).srt,155,696.74,701.875,_But if you use another threshold, you can easily fit that constant _
4 - 11 - 3.11 Text Categorization- Discriminative Classifier Part 2 (00-31-46).srt,156,701.875,707.3,into the parameter values b and w to make the right-hand side just 1. 
4 - 11 - 3.11 Text Categorization- Discriminative Classifier Part 2 (00-31-46).srt,157,708.95,714.78,_Now if, on the other hand, y i is -1, that means it's in a different class, _
4 - 11 - 3.11 Text Categorization- Discriminative Classifier Part 2 (00-31-46).srt,158,714.78,718.46,_then we want this classifier to give us a very small value, _
4 - 11 - 3.11 Text Categorization- Discriminative Classifier Part 2 (00-31-46).srt,159,718.46,724.86,_in fact a negative value, and we want this value to be less than or equal to -1. _
4 - 11 - 3.11 Text Categorization- Discriminative Classifier Part 2 (00-31-46).srt,160,724.86,731.11,_Now these are the two different instances, different kinds of cases. _
4 - 11 - 3.11 Text Categorization- Discriminative Classifier Part 2 (00-31-46).srt,161,731.11,733.714,How can we combine them together? 
